{
  "$schema": "https://json-schema.org/draft/2020-12/schema",
  "$id": "https://raw.githubusercontent.com/macintacos/coroner/main/schema/export-v1.schema.json",
  "$defs": {
    "Annotation": {
      "properties": {
        "id": {
          "type": "string",
          "description": "ID is the annotation's ID."
        },
        "timeline_id": {
          "type": "string",
          "description": "TimelineID is the ID of the annotation's timeline."
        },
        "event_id": {
          "oneOf": [
            {
              "type": "string"
            },
            {
              "type": "null"
            }
          ],
          "description": "EventID is the event annotated; null for an annotation on the whole timeline."
        },
        "kind": {
          "type": "string",
          "description": "Kind is evidence or comment. Consumers must accept values they do not know."
        },
        "body": {
          "type": "string",
          "description": "Body is the annotation's content."
        },
        "author": {
          "oneOf": [
            {
              "type": "string"
            },
            {
              "type": "null"
            }
          ],
          "description": "Author is the person who added the annotation, not necessarily its source."
        },
        "source": {
          "oneOf": [
            {
              "type": "string"
            },
            {
              "type": "null"
            }
          ],
          "description": "Source is the name of the source the annotation came from."
        },
        "url": {
          "oneOf": [
            {
              "type": "string"
            },
            {
              "type": "null"
            }
          ],
          "description": "URL is a permalink to the thing itself, such as the log line or chat message."
        },
        "created_at": {
          "type": "string",
          "pattern": "^[0-9]{4}-[0-9]{2}-[0-9]{2}T[0-9]{2}:[0-9]{2}:[0-9]{2}\\.[0-9]{9}Z$",
          "format": "date-time",
          "description": "CreatedAt is when the annotation was added to coroner."
        },
        "updated_at": {
          "type": "string",
          "pattern": "^[0-9]{4}-[0-9]{2}-[0-9]{2}T[0-9]{2}:[0-9]{2}:[0-9]{2}\\.[0-9]{9}Z$",
          "format": "date-time",
          "description": "UpdatedAt is when the annotation was last changed in coroner."
        }
      },
      "type": "object",
      "required": [
        "id",
        "timeline_id",
        "event_id",
        "kind",
        "body",
        "author",
        "source",
        "url",
        "created_at",
        "updated_at"
      ],
      "description": "Annotation is evidence or commentary attached to an event, or to its whole timeline."
    },
    "Attachment": {
      "properties": {
        "id": {
          "type": "string",
          "description": "ID is the attachment's ID."
        },
        "event_id": {
          "oneOf": [
            {
              "type": "string"
            },
            {
              "type": "null"
            }
          ],
          "description": "EventID is the event the file is kept with; null when an annotation keeps it."
        },
        "annotation_id": {
          "oneOf": [
            {
              "type": "string"
            },
            {
              "type": "null"
            }
          ],
          "description": "AnnotationID is the annotation the file is kept with; null when an event keeps it."
        },
        "filename": {
          "type": "string",
          "description": "Filename is the attached file's name, as display text; never a path."
        },
        "mime": {
          "type": "string",
          "description": "MIME is the media type detected when the file was attached, possibly with parameters such as charset."
        },
        "sha256": {
          "type": "string",
          "description": "SHA256 is the SHA-256 of the file's content, as 64 lowercase hex digits."
        },
        "size": {
          "type": "integer",
          "description": "Size is the size of the file's content, in bytes."
        },
        "created_at": {
          "type": "string",
          "pattern": "^[0-9]{4}-[0-9]{2}-[0-9]{2}T[0-9]{2}:[0-9]{2}:[0-9]{2}\\.[0-9]{9}Z$",
          "format": "date-time",
          "description": "CreatedAt is when the file was attached in coroner."
        }
      },
      "type": "object",
      "required": [
        "id",
        "event_id",
        "annotation_id",
        "filename",
        "mime",
        "sha256",
        "size",
        "created_at"
      ],
      "description": "Attachment is a file kept with one event or annotation. An export carries its metadata and hash, never its bytes."
    },
    "Event": {
      "properties": {
        "id": {
          "type": "string",
          "description": "ID is the event's ID."
        },
        "timeline_id": {
          "type": "string",
          "description": "TimelineID is the ID of the event's timeline."
        },
        "seq": {
          "oneOf": [
            {
              "type": "integer"
            },
            {
              "type": "null"
            }
          ],
          "description": "Seq is the event's permanent per-timeline counter value; null only in a preview of an event not yet added."
        },
        "occurred_at": {
          "type": "string",
          "pattern": "^[0-9]{4}-[0-9]{2}-[0-9]{2}T[0-9]{2}:[0-9]{2}:[0-9]{2}\\.[0-9]{9}Z$",
          "format": "date-time",
          "description": "OccurredAt is when the event happened, or its interval started: the start of its precision window."
        },
        "occurred_offset": {
          "oneOf": [
            {
              "type": "integer"
            },
            {
              "type": "null"
            }
          ],
          "description": "OccurredOffset is the input's offset from UTC in seconds, positive east; null when the input was Z or an epoch, or was read in UTC, which say nothing about a local offset."
        },
        "precision": {
          "type": "string",
          "description": "Precision is how exact occurred_at is, from day to nanosecond. Consumers must accept values they do not know."
        },
        "approximate": {
          "type": "boolean",
          "description": "Approximate marks occurred_at as a guess."
        },
        "occurred_raw": {
          "oneOf": [
            {
              "type": "string"
            },
            {
              "type": "null"
            }
          ],
          "description": "OccurredRaw is the time exactly as it was given."
        },
        "ended_at": {
          "oneOf": [
            {
              "type": "string",
              "pattern": "^[0-9]{4}-[0-9]{2}-[0-9]{2}T[0-9]{2}:[0-9]{2}:[0-9]{2}\\.[0-9]{9}Z$",
              "format": "date-time"
            },
            {
              "type": "null"
            }
          ],
          "description": "EndedAt is when the interval ended; null for an event at a single moment."
        },
        "source": {
          "oneOf": [
            {
              "type": "string"
            },
            {
              "type": "null"
            }
          ],
          "description": "Source is the name of the source the event came from."
        },
        "tags": {
          "items": {
            "type": "string"
          },
          "type": "array",
          "description": "Tags are lowercase keywords, such as phase:detect."
        },
        "text": {
          "type": "string",
          "description": "Text is what happened."
        },
        "url": {
          "oneOf": [
            {
              "type": "string"
            },
            {
              "type": "null"
            }
          ],
          "description": "URL is a permalink to the thing itself, such as the log line or chat message."
        },
        "author": {
          "oneOf": [
            {
              "type": "string"
            },
            {
              "type": "null"
            }
          ],
          "description": "Author is the person who added the event, not necessarily its source."
        },
        "created_at": {
          "type": "string",
          "pattern": "^[0-9]{4}-[0-9]{2}-[0-9]{2}T[0-9]{2}:[0-9]{2}:[0-9]{2}\\.[0-9]{9}Z$",
          "format": "date-time",
          "description": "CreatedAt is when the event was added to coroner."
        },
        "updated_at": {
          "type": "string",
          "pattern": "^[0-9]{4}-[0-9]{2}-[0-9]{2}T[0-9]{2}:[0-9]{2}:[0-9]{2}\\.[0-9]{9}Z$",
          "format": "date-time",
          "description": "UpdatedAt is when the event was last changed in coroner."
        }
      },
      "type": "object",
      "required": [
        "id",
        "timeline_id",
        "seq",
        "occurred_at",
        "occurred_offset",
        "precision",
        "approximate",
        "occurred_raw",
        "ended_at",
        "source",
        "tags",
        "text",
        "url",
        "author",
        "created_at",
        "updated_at"
      ],
      "description": "Event is something that happened at a moment, or over an interval, as a source reported it."
    },
    "Link": {
      "properties": {
        "id": {
          "type": "string",
          "description": "ID is the link's ID."
        },
        "from_event_id": {
          "type": "string",
          "description": "FromEventID is the event the link leaves."
        },
        "to_event_id": {
          "type": "string",
          "description": "ToEventID is the event the link reaches."
        },
        "kind": {
          "type": "string",
          "description": "Kind is led_to, same_as or copied_from. Consumers must accept values they do not know."
        },
        "created_at": {
          "type": "string",
          "pattern": "^[0-9]{4}-[0-9]{2}-[0-9]{2}T[0-9]{2}:[0-9]{2}:[0-9]{2}\\.[0-9]{9}Z$",
          "format": "date-time",
          "description": "CreatedAt is when the link was added in coroner."
        },
        "author": {
          "oneOf": [
            {
              "type": "string"
            },
            {
              "type": "null"
            }
          ],
          "description": "Author is the person who added the link."
        }
      },
      "type": "object",
      "required": [
        "id",
        "from_event_id",
        "to_event_id",
        "kind",
        "created_at",
        "author"
      ],
      "description": "Link is a directed, typed link from one exported event to another, in the same timeline or another."
    },
    "Query": {
      "properties": {
        "timelines": {
          "items": {
            "type": "string"
          },
          "type": "array",
          "description": "Timelines are the names of the timelines exported."
        },
        "since": {
          "oneOf": [
            {
              "type": "string",
              "pattern": "^[0-9]{4}-[0-9]{2}-[0-9]{2}T[0-9]{2}:[0-9]{2}:[0-9]{2}\\.[0-9]{9}Z$",
              "format": "date-time"
            },
            {
              "type": "null"
            }
          ],
          "description": "Since keeps events that occurred at or after it."
        },
        "until": {
          "oneOf": [
            {
              "type": "string",
              "pattern": "^[0-9]{4}-[0-9]{2}-[0-9]{2}T[0-9]{2}:[0-9]{2}:[0-9]{2}\\.[0-9]{9}Z$",
              "format": "date-time"
            },
            {
              "type": "null"
            }
          ],
          "description": "Until keeps events that occurred before it."
        },
        "sources": {
          "items": {
            "type": "string"
          },
          "type": "array",
          "description": "Sources keeps events from any of these source names."
        },
        "tags": {
          "items": {
            "type": "string"
          },
          "type": "array",
          "description": "Tags keeps events carrying all of these tags."
        },
        "contains": {
          "oneOf": [
            {
              "type": "string"
            },
            {
              "type": "null"
            }
          ],
          "description": "Contains keeps events whose text contains it, ignoring ASCII case."
        },
        "limit": {
          "oneOf": [
            {
              "type": "integer"
            },
            {
              "type": "null"
            }
          ],
          "description": "Limit caps how many events were exported."
        },
        "order": {
          "type": "string",
          "description": "Order is which end Limit kept events from: asc the earliest, desc the latest. Exported events are listed in ascending order either way."
        }
      },
      "type": "object",
      "required": [
        "timelines",
        "since",
        "until",
        "sources",
        "tags",
        "contains",
        "limit",
        "order"
      ],
      "description": "Query is the selection an export was made with. Every field but Timelines and Order filters events, and null or an empty list means that filter was not applied."
    },
    "Source": {
      "properties": {
        "id": {
          "type": "string",
          "description": "ID is the source's ID."
        },
        "name": {
          "type": "string",
          "description": "Name is the source's name, such as slack or db-2/mongod."
        },
        "created_at": {
          "type": "string",
          "pattern": "^[0-9]{4}-[0-9]{2}-[0-9]{2}T[0-9]{2}:[0-9]{2}:[0-9]{2}\\.[0-9]{9}Z$",
          "format": "date-time",
          "description": "CreatedAt is when the source was first recorded in coroner."
        }
      },
      "type": "object",
      "required": [
        "id",
        "name",
        "created_at"
      ],
      "description": "Source is the system, service or person an event or annotation came from."
    },
    "Timeline": {
      "properties": {
        "id": {
          "type": "string",
          "description": "ID is the timeline's ID."
        },
        "name": {
          "type": "string",
          "description": "Name is the timeline's unique name, such as mongo-outage."
        },
        "title": {
          "type": "string",
          "description": "Title is a free-text heading; it may be empty."
        },
        "refs": {
          "items": {
            "type": "string"
          },
          "type": "array",
          "description": "Refs are issue-tracker keys or URLs the timeline belongs to, kept as written."
        },
        "created_at": {
          "type": "string",
          "pattern": "^[0-9]{4}-[0-9]{2}-[0-9]{2}T[0-9]{2}:[0-9]{2}:[0-9]{2}\\.[0-9]{9}Z$",
          "format": "date-time",
          "description": "CreatedAt is when the timeline was created in coroner."
        }
      },
      "type": "object",
      "required": [
        "id",
        "name",
        "title",
        "refs",
        "created_at"
      ],
      "description": "Timeline is the named chronology of one investigation."
    }
  },
  "properties": {
    "format": {
      "type": "string",
      "description": "Format is always \"coroner.export\"."
    },
    "format_version": {
      "type": "string",
      "description": "FormatVersion is the MAJOR.MINOR version of the export format."
    },
    "coroner_version": {
      "type": "string",
      "description": "CoronerVersion is the version of coroner that wrote the export."
    },
    "exported_at": {
      "type": "string",
      "pattern": "^[0-9]{4}-[0-9]{2}-[0-9]{2}T[0-9]{2}:[0-9]{2}:[0-9]{2}\\.[0-9]{9}Z$",
      "format": "date-time",
      "description": "ExportedAt is when the export was written."
    },
    "query": {
      "$ref": "#/$defs/Query",
      "description": "Query is the selection the export was made with."
    },
    "timelines": {
      "items": {
        "$ref": "#/$defs/Timeline"
      },
      "type": "array",
      "description": "Timelines are the exported timelines."
    },
    "sources": {
      "items": {
        "$ref": "#/$defs/Source"
      },
      "type": "array",
      "description": "Sources are the sources the exported events and annotations name."
    },
    "events": {
      "items": {
        "$ref": "#/$defs/Event"
      },
      "type": "array",
      "description": "Events are the exported events, from every exported timeline."
    },
    "annotations": {
      "items": {
        "$ref": "#/$defs/Annotation"
      },
      "type": "array",
      "description": "Annotations are the exported annotations."
    },
    "attachments": {
      "items": {
        "$ref": "#/$defs/Attachment"
      },
      "type": "array",
      "description": "Attachments are the attachments of the exported events and annotations."
    },
    "links": {
      "items": {
        "$ref": "#/$defs/Link"
      },
      "type": "array",
      "description": "Links are the links between exported events."
    }
  },
  "type": "object",
  "required": [
    "format",
    "format_version",
    "coroner_version",
    "exported_at",
    "query",
    "timelines",
    "sources",
    "events",
    "annotations"
  ],
  "description": "Envelope is a whole export: what was exported, by which coroner, when and with which query, and the flat record lists."
}
