{"format":"coroner.export","format_version":"1.1","coroner_version":"(devel)","exported_at":"2026-09-13T02:05:00.000000000Z","query":{"timelines":["full-model"],"since":null,"until":null,"sources":[],"tags":[],"contains":null,"limit":null,"order":"asc"},"timelines":[{"id":"01a09862-b1c0-7000-8000-000000000001","name":"full-model","title":"Mongo primary election","refs":["INC-4821","https://tracker.example.com/INC-4821"],"created_at":"2026-09-13T01:30:00.000000000Z"}],"sources":[{"id":"01a09862-b1c0-7000-8000-00000000000d","name":"api","created_at":"2026-09-13T01:30:00.000000000Z"},{"id":"01a09862-b1c0-7000-8000-000000000003","name":"change-calendar","created_at":"2026-09-13T01:30:00.000000000Z"},{"id":"01a09862-b1c0-7000-8000-000000000005","name":"cron","created_at":"2026-09-13T01:30:00.000000000Z"},{"id":"01a09862-b1c0-7000-8000-000000000007","name":"grafana","created_at":"2026-09-13T01:30:00.000000000Z"},{"id":"01a09862-b1c0-7000-8000-000000000009","name":"mongod","created_at":"2026-09-13T01:30:00.000000000Z"}],"events":[{"id":"01a09862-b1c0-7000-8000-000000000002","timeline_id":"01a09862-b1c0-7000-8000-000000000001","seq":1,"occurred_at":"2026-09-11T00:00:00.000000000Z","occurred_offset":0,"precision":"day","approximate":false,"occurred_raw":"2026-09-11","ended_at":null,"source":"change-calendar","tags":["phase:context"],"text":"Maintenance window opens","url":null,"author":"julian","created_at":"2026-09-13T01:30:00.000000000Z","updated_at":"2026-09-13T01:30:00.000000000Z"},{"id":"01a09862-b1c0-7000-8000-000000000004","timeline_id":"01a09862-b1c0-7000-8000-000000000001","seq":2,"occurred_at":"2026-09-11T03:00:00.000000000Z","occurred_offset":0,"precision":"hour","approximate":false,"occurred_raw":"2026-09-11 3am","ended_at":null,"source":"cron","tags":[],"text":"Nightly backup starts","url":null,"author":"julian","created_at":"2026-09-13T01:30:00.000000000Z","updated_at":"2026-09-13T01:30:00.000000000Z"},{"id":"01a09862-b1c0-7000-8000-000000000006","timeline_id":"01a09862-b1c0-7000-8000-000000000001","seq":3,"occurred_at":"2026-09-11T03:10:00.000000000Z","occurred_offset":0,"precision":"minute","approximate":false,"occurred_raw":"2026-09-11T03:10","ended_at":null,"source":"grafana","tags":[],"text":"Oplog window drops under an hour","url":null,"author":"julian","created_at":"2026-09-13T01:30:00.000000000Z","updated_at":"2026-09-13T01:30:00.000000000Z"},{"id":"01a09862-b1c0-7000-8000-000000000010","timeline_id":"01a09862-b1c0-7000-8000-000000000001","seq":8,"occurred_at":"2026-09-11T03:14:00.000000000Z","occurred_offset":null,"precision":"second","approximate":true,"occurred_raw":"~2026-09-11T03:14:00Z","ended_at":"2026-09-11T03:16:30.000000000Z","source":null,"tags":[],"text":"Replica set has no primary","url":null,"author":null,"created_at":"2026-09-13T01:30:00.000000000Z","updated_at":"2026-09-13T01:30:00.000000000Z"},{"id":"01a09862-b1c0-7000-8000-000000000008","timeline_id":"01a09862-b1c0-7000-8000-000000000001","seq":4,"occurred_at":"2026-09-11T03:14:07.000000000Z","occurred_offset":7200,"precision":"second","approximate":false,"occurred_raw":"2026-09-11T05:14:07+02:00","ended_at":null,"source":"mongod","tags":["election","phase:detect","root-cause","severity:high"],"text":"Primary stepped down","url":"https://logs.example.com/l/81723","author":"julian","created_at":"2026-09-13T01:30:00.000000000Z","updated_at":"2026-09-13T02:05:00.000000000Z"},{"id":"01a09862-b1c0-7000-8000-00000000000a","timeline_id":"01a09862-b1c0-7000-8000-000000000001","seq":5,"occurred_at":"2026-09-11T03:14:07.412000000Z","occurred_offset":null,"precision":"millisecond","approximate":false,"occurred_raw":"2026-09-11T03:14:07.412Z","ended_at":null,"source":"mongod","tags":[],"text":"Election timeout on db-3","url":null,"author":"julian","created_at":"2026-09-13T01:30:00.000000000Z","updated_at":"2026-09-13T01:30:00.000000000Z"},{"id":"01a09862-b1c0-7000-8000-00000000000c","timeline_id":"01a09862-b1c0-7000-8000-000000000001","seq":6,"occurred_at":"2026-09-11T03:14:07.412123000Z","occurred_offset":null,"precision":"microsecond","approximate":false,"occurred_raw":"2026-09-11T03:14:07.412123Z","ended_at":null,"source":"api","tags":[],"text":"Driver saw NotWritablePrimary","url":null,"author":"julian","created_at":"2026-09-13T01:30:00.000000000Z","updated_at":"2026-09-13T01:30:00.000000000Z"},{"id":"01a09862-b1c0-7000-8000-00000000000e","timeline_id":"01a09862-b1c0-7000-8000-000000000001","seq":7,"occurred_at":"2026-09-11T03:14:08.123456789Z","occurred_offset":null,"precision":"nanosecond","approximate":false,"occurred_raw":"1789096448123456789","ended_at":null,"source":"mongod","tags":[],"text":"db-2 elected primary","url":null,"author":"julian","created_at":"2026-09-13T01:30:00.000000000Z","updated_at":"2026-09-13T01:30:00.000000000Z"}],"annotations":[{"id":"01a09862-b1c0-7000-8000-000000000011","timeline_id":"01a09862-b1c0-7000-8000-000000000001","event_id":"01a09862-b1c0-7000-8000-000000000010","kind":"evidence","body":"rs.status() showed no primary","author":"julian","source":"mongod","url":"https://logs.example.com/l/81730","created_at":"2026-09-13T01:30:00.000000000Z","updated_at":"2026-09-13T01:30:00.000000000Z"},{"id":"01a09862-b1c0-7000-8000-000000000013","timeline_id":"01a09862-b1c0-7000-8000-000000000001","event_id":"01a09862-b1c0-7000-8000-000000000008","kind":"comment","body":"Step-down follows the oplog alert by four minutes","author":"julian","source":null,"url":null,"created_at":"2026-09-13T01:30:00.000000000Z","updated_at":"2026-09-13T01:30:00.000000000Z"}],"attachments":[]}
