{"format":"coroner.export","format_version":"1.1","coroner_version":"(devel)","exported_at":"2026-09-13T01:40:00.000000000Z","query":{"timelines":["attachments"],"since":null,"until":null,"sources":[],"tags":[],"contains":null,"limit":null,"order":"asc"},"timelines":[{"id":"01a09862-b1c0-7000-8000-000000000001","name":"attachments","title":"","refs":[],"created_at":"2026-09-13T01:30:00.000000000Z"}],"sources":[{"id":"01a09862-b1c0-7000-8000-000000000003","name":"mongod","created_at":"2026-09-13T01:30:00.000000000Z"},{"id":"01a09862-b1c0-7000-8000-000000000006","name":"pagerduty","created_at":"2026-09-13T01:30:00.000000000Z"}],"events":[{"id":"01a09862-b1c0-7000-8000-000000000002","timeline_id":"01a09862-b1c0-7000-8000-000000000001","seq":1,"occurred_at":"2026-09-11T03:14:07.000000000Z","occurred_offset":null,"precision":"second","approximate":false,"occurred_raw":"2026-09-11T03:14:07Z","ended_at":null,"source":"mongod","tags":[],"text":"Primary stepped down","url":null,"author":null,"created_at":"2026-09-13T01:30:00.000000000Z","updated_at":"2026-09-13T01:40:00.000000000Z"},{"id":"01a09862-b1c0-7000-8000-000000000005","timeline_id":"01a09862-b1c0-7000-8000-000000000001","seq":2,"occurred_at":"2026-09-11T03:15:00.000000000Z","occurred_offset":null,"precision":"second","approximate":false,"occurred_raw":"2026-09-11T03:15:00Z","ended_at":null,"source":"pagerduty","tags":[],"text":"Pager fires for db-2","url":null,"author":null,"created_at":"2026-09-13T01:30:00.000000000Z","updated_at":"2026-09-13T01:30:00.000000000Z"}],"annotations":[{"id":"01a09862-b1c0-7000-8000-000000000007","timeline_id":"01a09862-b1c0-7000-8000-000000000001","event_id":"01a09862-b1c0-7000-8000-000000000002","kind":"evidence","body":"rs.status() showed no primary","author":null,"source":null,"url":null,"created_at":"2026-09-13T01:30:00.000000000Z","updated_at":"2026-09-13T01:30:00.000000000Z"},{"id":"01a09862-b1c0-7000-8000-000000000009","timeline_id":"01a09862-b1c0-7000-8000-000000000001","event_id":null,"kind":"comment","body":"Checkout p99 from Grafana","author":null,"source":null,"url":null,"created_at":"2026-09-13T01:30:00.000000000Z","updated_at":"2026-09-13T01:30:00.000000000Z"}],"attachments":[{"id":"01a09862-b1c0-7000-8000-000000000004","event_id":"01a09862-b1c0-7000-8000-000000000002","annotation_id":null,"filename":"stepdown.log","mime":"text/plain; charset=utf-8","sha256":"6f5afe8fbd22f34daf4461c43c1f2df08102356cba27122867011e1c98e0bb69","size":168,"created_at":"2026-09-13T01:30:00.000000000Z"},{"id":"01a09862-b1c0-7000-8000-000000000008","event_id":null,"annotation_id":"01a09862-b1c0-7000-8000-000000000007","filename":"rs-status.json","mime":"application/json","sha256":"ac0f23b57f82eec54bce94c625d56690f5a12ce0e8459914c23458bffe6fdd19","size":31,"created_at":"2026-09-13T01:30:00.000000000Z"},{"id":"01a09862-b1c0-7000-8000-00000000000a","event_id":null,"annotation_id":"01a09862-b1c0-7000-8000-000000000009","filename":"p99.svg","mime":"image/svg+xml","sha256":"c2232ba586506a09bcc96bf250b16163be94592ee3754468436316eb0eb5255b","size":108,"created_at":"2026-09-13T01:30:00.000000000Z"},{"id":"01a0986b-d980-7000-8000-00000000000c","event_id":"01a09862-b1c0-7000-8000-000000000002","annotation_id":null,"filename":"p99.svg","mime":"image/svg+xml","sha256":"c2232ba586506a09bcc96bf250b16163be94592ee3754468436316eb0eb5255b","size":108,"created_at":"2026-09-13T01:40:00.000000000Z"}]}
