{"format":"coroner.export","format_version":"1.2","coroner_version":"(devel)","exported_at":"2026-09-13T01:40:00.000000000Z","query":{"timelines":["mongo-failover","checkout-latency"],"since":null,"until":null,"sources":[],"tags":[],"contains":null,"limit":null,"order":"asc"},"timelines":[{"id":"01a09862-b1c0-7000-8000-000000000001","name":"mongo-failover","title":"","refs":[],"created_at":"2026-09-13T01:30:00.000000000Z"},{"id":"01a09862-b1c0-7000-8000-000000000002","name":"checkout-latency","title":"","refs":[],"created_at":"2026-09-13T01:30:00.000000000Z"}],"sources":[{"id":"01a09862-b1c0-7000-8000-000000000006","name":"grafana","created_at":"2026-09-13T01:30:00.000000000Z"},{"id":"01a09862-b1c0-7000-8000-000000000004","name":"mongod","created_at":"2026-09-13T01:30:00.000000000Z"},{"id":"01a09862-b1c0-7000-8000-000000000008","name":"slack","created_at":"2026-09-13T01:30:00.000000000Z"}],"events":[{"id":"01a09862-b1c0-7000-8000-000000000003","timeline_id":"01a09862-b1c0-7000-8000-000000000001","seq":1,"occurred_at":"2026-09-11T03:14:07.000000000Z","occurred_offset":null,"precision":"second","approximate":false,"occurred_raw":"2026-09-11T03:14:07Z","ended_at":null,"source":"mongod","tags":[],"text":"Primary stepped down","url":null,"author":null,"created_at":"2026-09-13T01:30:00.000000000Z","updated_at":"2026-09-13T01:30:00.000000000Z"},{"id":"01a0986b-d980-7000-8000-00000000000c","timeline_id":"01a09862-b1c0-7000-8000-000000000002","seq":3,"occurred_at":"2026-09-11T03:14:07.000000000Z","occurred_offset":null,"precision":"second","approximate":false,"occurred_raw":"2026-09-11T03:14:07Z","ended_at":null,"source":"mongod","tags":[],"text":"Incident timeline copied from the failover","url":null,"author":null,"created_at":"2026-09-13T01:40:00.000000000Z","updated_at":"2026-09-13T01:40:00.000000000Z"},{"id":"01a09862-b1c0-7000-8000-000000000005","timeline_id":"01a09862-b1c0-7000-8000-000000000002","seq":1,"occurred_at":"2026-09-11T03:15:00.000000000Z","occurred_offset":null,"precision":"second","approximate":false,"occurred_raw":"2026-09-11T03:15:00Z","ended_at":null,"source":"grafana","tags":[],"text":"Checkout p99 above 2s","url":null,"author":null,"created_at":"2026-09-13T01:30:00.000000000Z","updated_at":"2026-09-13T01:30:00.000000000Z"},{"id":"01a09862-b1c0-7000-8000-000000000007","timeline_id":"01a09862-b1c0-7000-8000-000000000002","seq":2,"occurred_at":"2026-09-11T03:16:00.000000000Z","occurred_offset":null,"precision":"second","approximate":false,"occurred_raw":"2026-09-11T03:16:00Z","ended_at":null,"source":"slack","tags":[],"text":"Slack: is checkout down?","url":null,"author":null,"created_at":"2026-09-13T01:30:00.000000000Z","updated_at":"2026-09-13T01:30:00.000000000Z"}],"annotations":[],"attachments":[],"links":[{"id":"01a09862-b1c0-7000-8000-00000000000a","from_event_id":"01a09862-b1c0-7000-8000-000000000003","to_event_id":"01a09862-b1c0-7000-8000-000000000005","kind":"led_to","created_at":"2026-09-13T01:30:00.000000000Z","author":"julian"},{"id":"01a09862-b1c0-7000-8000-00000000000b","from_event_id":"01a09862-b1c0-7000-8000-000000000007","to_event_id":"01a09862-b1c0-7000-8000-000000000005","kind":"same_as","created_at":"2026-09-13T01:30:00.000000000Z","author":null},{"id":"01a0986b-d980-7000-8000-00000000000e","from_event_id":"01a0986b-d980-7000-8000-00000000000c","to_event_id":"01a09862-b1c0-7000-8000-000000000003","kind":"copied_from","created_at":"2026-09-13T01:40:00.000000000Z","author":"julian"}]}
