{"format":"coroner.export","format_version":"1.2","coroner_version":"(devel)","exported_at":"2026-09-13T01:40:00.000000000Z","query":{"timelines":["times"],"since":null,"until":null,"sources":[],"tags":[],"contains":null,"limit":null,"order":"asc"},"timelines":[{"id":"01a09862-b1c0-7000-8000-000000000001","name":"times","title":"","refs":[],"created_at":"2026-09-13T01:30:00.000000000Z"}],"sources":[],"events":[
{"id":"01a09862-b1c0-7000-8000-000000000002","timeline_id":"01a09862-b1c0-7000-8000-000000000001","seq":1,"occurred_at":"2026-09-11T00:00:00.000000000Z","occurred_offset":0,"precision":"day","approximate":false,"occurred_raw":null,"ended_at":"2026-09-12T00:00:00.000000000Z","source":null,"tags":[],"text":"E2","url":null,"author":null,"created_at":"2026-09-13T01:30:00.000000000Z","updated_at":"2026-09-13T01:30:00.000000000Z"},
{"id":"01a09862-b1c0-7000-8000-000000000003","timeline_id":"01a09862-b1c0-7000-8000-000000000001","seq":2,"occurred_at":"2026-09-11T03:00:00.000000000Z","occurred_offset":0,"precision":"hour","approximate":false,"occurred_raw":null,"ended_at":null,"source":null,"tags":[],"text":"E4","url":null,"author":null,"created_at":"2026-09-13T01:30:00.000000000Z","updated_at":"2026-09-13T01:30:00.000000000Z"},
{"id":"01a09862-b1c0-7000-8000-000000000004","timeline_id":"01a09862-b1c0-7000-8000-000000000001","seq":3,"occurred_at":"2026-09-11T03:14:00.000000000Z","occurred_offset":0,"precision":"minute","approximate":true,"occurred_raw":null,"ended_at":null,"source":null,"tags":[],"text":"E5","url":null,"author":null,"created_at":"2026-09-13T01:30:00.000000000Z","updated_at":"2026-09-13T01:30:00.000000000Z"},
{"id":"01a09862-b1c0-7000-8000-000000000005","timeline_id":"01a09862-b1c0-7000-8000-000000000001","seq":4,"occurred_at":"2026-09-11T03:14:07.000000000Z","occurred_offset":0,"precision":"second","approximate":false,"occurred_raw":null,"ended_at":null,"source":null,"tags":[],"text":"E6","url":null,"author":null,"created_at":"2026-09-13T01:30:00.000000000Z","updated_at":"2026-09-13T01:30:00.000000000Z"},
{"id":"01a09862-b1c0-7000-8000-000000000006","timeline_id":"01a09862-b1c0-7000-8000-000000000001","seq":5,"occurred_at":"2026-09-11T03:14:07.180000000Z","occurred_offset":0,"precision":"millisecond","approximate":false,"occurred_raw":null,"ended_at":null,"source":null,"tags":[],"text":"E7","url":null,"author":null,"created_at":"2026-09-13T01:30:00.000000000Z","updated_at":"2026-09-13T01:30:00.000000000Z"},
{"id":"01a09862-b1c0-7000-8000-000000000007","timeline_id":"01a09862-b1c0-7000-8000-000000000001","seq":6,"occurred_at":"2026-09-11T03:14:07.180342000Z","occurred_offset":0,"precision":"microsecond","approximate":false,"occurred_raw":null,"ended_at":null,"source":null,"tags":[],"text":"E8","url":null,"author":null,"created_at":"2026-09-13T01:30:00.000000000Z","updated_at":"2026-09-13T01:30:00.000000000Z"},
{"id":"01a09862-b1c0-7000-8000-000000000008","timeline_id":"01a09862-b1c0-7000-8000-000000000001","seq":7,"occurred_at":"2026-09-11T03:14:07.180342917Z","occurred_offset":0,"precision":"nanosecond","approximate":false,"occurred_raw":null,"ended_at":null,"source":null,"tags":[],"text":"E9","url":null,"author":null,"created_at":"2026-09-13T01:30:00.000000000Z","updated_at":"2026-09-13T01:30:00.000000000Z"},
{"id":"01a09862-b1c0-7000-8000-000000000009","timeline_id":"01a09862-b1c0-7000-8000-000000000001","seq":8,"occurred_at":"2026-09-11T03:15:00.000000000Z","occurred_offset":0,"precision":"second","approximate":false,"occurred_raw":null,"ended_at":"2026-09-11T03:16:30.000000000Z","source":null,"tags":[],"text":"E10","url":null,"author":null,"created_at":"2026-09-13T01:30:00.000000000Z","updated_at":"2026-09-13T01:30:00.000000000Z"},
{"id":"01a09862-b1c0-7000-8000-00000000000a","timeline_id":"01a09862-b1c0-7000-8000-000000000001","seq":9,"occurred_at":"2026-09-11T04:30:00.000000000Z","occurred_offset":19800,"precision":"hour","approximate":false,"occurred_raw":null,"ended_at":null,"source":null,"tags":[],"text":"E3","url":null,"author":null,"created_at":"2026-09-13T01:30:00.000000000Z","updated_at":"2026-09-13T01:30:00.000000000Z"},
{"id":"01a09862-b1c0-7000-8000-00000000000b","timeline_id":"01a09862-b1c0-7000-8000-000000000001","seq":10,"occurred_at":"2026-09-11T05:00:00.000000000Z","occurred_offset":-18000,"precision":"day","approximate":false,"occurred_raw":null,"ended_at":null,"source":null,"tags":[],"text":"E1","url":null,"author":null,"created_at":"2026-09-13T01:30:00.000000000Z","updated_at":"2026-09-13T01:30:00.000000000Z"},
{"id":"01a09862-b1c0-7000-8000-00000000000c","timeline_id":"01a09862-b1c0-7000-8000-000000000001","seq":11,"occurred_at":"2026-09-11T20:30:00.000000000Z","occurred_offset":19800,"precision":"hour","approximate":false,"occurred_raw":null,"ended_at":null,"source":null,"tags":[],"text":"E13","url":null,"author":null,"created_at":"2026-09-13T01:30:00.000000000Z","updated_at":"2026-09-13T01:30:00.000000000Z"},
{"id":"01a09862-b1c0-7000-8000-00000000000d","timeline_id":"01a09862-b1c0-7000-8000-000000000001","seq":12,"occurred_at":"2026-09-11T20:30:00.000000000Z","occurred_offset":19800,"precision":"hour","approximate":true,"occurred_raw":null,"ended_at":"2026-09-11T22:30:00.000000000Z","source":null,"tags":[],"text":"E14","url":null,"author":null,"created_at":"2026-09-13T01:30:00.000000000Z","updated_at":"2026-09-13T01:30:00.000000000Z"},
{"id":"01a09862-b1c0-7000-8000-00000000000e","timeline_id":"01a09862-b1c0-7000-8000-000000000001","seq":13,"occurred_at":"2026-09-11T23:50:00.000000000Z","occurred_offset":0,"precision":"minute","approximate":false,"occurred_raw":null,"ended_at":"2026-09-12T00:20:00.000000000Z","source":null,"tags":[],"text":"E11","url":null,"author":null,"created_at":"2026-09-13T01:30:00.000000000Z","updated_at":"2026-09-13T01:30:00.000000000Z"},
{"id":"01a09862-b1c0-7000-8000-00000000000f","timeline_id":"01a09862-b1c0-7000-8000-000000000001","seq":14,"occurred_at":"2026-09-12T00:00:00.000000000Z","occurred_offset":0,"precision":"day","approximate":true,"occurred_raw":null,"ended_at":null,"source":null,"tags":[],"text":"E12","url":null,"author":null,"created_at":"2026-09-13T01:30:00.000000000Z","updated_at":"2026-09-13T01:30:00.000000000Z"},
{"id":"01a09862-b1c0-7000-8000-000000000010","timeline_id":"01a09862-b1c0-7000-8000-000000000001","seq":15,"occurred_at":"2026-11-01T05:30:00.000000000Z","occurred_offset":-14400,"precision":"second","approximate":false,"occurred_raw":null,"ended_at":null,"source":null,"tags":[],"text":"E15","url":null,"author":null,"created_at":"2026-09-13T01:30:00.000000000Z","updated_at":"2026-09-13T01:30:00.000000000Z"},
{"id":"01a09862-b1c0-7000-8000-000000000011","timeline_id":"01a09862-b1c0-7000-8000-000000000001","seq":16,"occurred_at":"2026-11-01T06:30:00.000000000Z","occurred_offset":-18000,"precision":"second","approximate":false,"occurred_raw":null,"ended_at":"2026-11-01T06:45:00.000000000Z","source":null,"tags":[],"text":"E16","url":null,"author":null,"created_at":"2026-09-13T01:30:00.000000000Z","updated_at":"2026-09-13T01:30:00.000000000Z"}
],"annotations":[],"attachments":[],"links":[]}
